{
  "schemaVersion": 1,
  "registryId": "sniper-current-render-effects-v1",
  "stages": [
    "source-authority",
    "timeline-map",
    "base",
    "scene",
    "composite",
    "final"
  ],
  "documents": {
    "plan": {
      "privatePrefix": "_",
      "rootFields": [
        "audioEnhance",
        "audioGain",
        "audioAuthorityMode",
        "audioReviewSections",
        "baselineLook",
        "brollTrack",
        "captionChapters",
        "captionCorrectionLedger",
        "captionStyles",
        "captions",
        "captionsTrack",
        "chapters",
        "cutDecisions",
        "cutRepairPicturePlanAuthority",
        "cutTrack",
        "dialogueCaptionAuthority",
        "ending",
        "faceBBoxNorm",
        "graphicsDecisions",
        "graphicsTrack",
        "music",
        "persistentText",
        "planVersion",
        "presenter",
        "presenterLayouts",
        "punchIns",
        "reframe",
        "target",
        "titleCards",
        "transitionRationale",
        "transitions",
        "treatmentMap"
      ]
    },
    "manifest": {
      "privatePrefix": "_",
      "rootFields": [
        "broll",
        "externalMedia",
        "generatedAt",
        "input",
        "music",
        "sourceSetAdmission",
        "sources"
      ]
    }
  },
  "discovery": {
    "entrypoints": [
      "scripts/producer/render.py",
      "scripts/producer/assemble.py",
      "scripts/producer/current_render_graph_build.py",
      "scripts/producer/current_render_graph_cli.py",
      "scripts/producer/motion/punch_in.py",
      "scripts/producer/motion/reframe_split.py",
      "scripts/producer/motion/face_track.py",
      "scripts/producer/motion/reframe.py",
      "scripts/producer/graphics/graphics_stage.py",
      "scripts/producer/audio/audio_enhance.py",
      "scripts/producer/audio/audio_gain.py",
      "scripts/producer/audit/audit_render.py"
    ],
    "nonAssetManifestReads": {
      "scripts/producer/captions/caption_page_contract.py": [
        "authorityHash", "captionAuthorityHash", "compositorHash",
        "destination", "entries", "fps", "kind", "maxPageFrames",
        "schemaVersion", "shardManifestHash", "totalFrames"
      ],
      "scripts/producer/captions/caption_page_media.py": [
        "fps"
      ],
      "scripts/producer/captions/caption_pages.py": [
        "authorityHash",
        "destination",
        "entries",
        "fps"
      ],
      "scripts/producer/captions/caption_shard_authority.py": [
        "authorityHash",
        "entries"
      ],
      "scripts/producer/captions/caption_shard_composite.py": [
        "destination",
        "entries",
        "fps"
      ],
      "scripts/producer/captions/caption_shard_contract.py": [
        "destination",
        "fps"
      ],
      "scripts/producer/current_render_graph_build.py": [
        "entries"
      ],
      "scripts/producer/guided_caption_projection_contract.py": [
        "captionAuthorityHash", "compositorHash", "shardManifestHash"
      ]
    }
  },
  "effects": [
    {
      "effectId": "plan-target",
      "document": "plan",
      "rootFields": ["target"],
      "patterns": ["/target/**"],
      "classification": "render-affecting",
      "stageRoots": ["base", "final"],
      "authorityEffects": ["mode, canvas, defaults, lane policy, and delivery profile"],
      "readerFiles": ["scripts/producer/render.py", "scripts/producer/plan_lint.py"],
      "mutations": [
        {"caseId": "target-mode", "fixture": "short-basic", "pointer": "/target/mode", "after": "longform", "expectedChangedRoots": ["plan.base", "plan.final"], "expectedBaseReuse": false}
      ]
    },
    {
      "effectId": "plan-cut-track",
      "document": "plan",
      "rootFields": ["cutTrack"],
      "patterns": ["/cutTrack/**"],
      "classification": "render-affecting",
      "stageRoots": ["timeline-map", "base", "final"],
      "authorityEffects": ["source ranges, speed, audio lead, output clock, and cut seams"],
      "readerFiles": ["scripts/producer/compile_timeline.py", "scripts/producer/cut_speed.py"],
      "mutations": [
        {"caseId": "cut-end", "fixture": "short-basic", "pointer": "/cutTrack/0/end", "after": 3.5, "expectedChangedRoots": ["plan.base", "plan.final", "plan.timeline"], "expectedBaseReuse": false},
        {"caseId": "cut-seam-drives-exit", "fixture": "exit-on-cut-active", "pointer": "/cutTrack/0/end", "after": 1.5, "expectedChangedRoots": ["plan.base", "plan.composite", "plan.final", "plan.scene.0000", "plan.timeline"], "expectedBaseReuse": false, "expectedEffectiveEnd": 1.5}
      ]
    },
    {
      "effectId": "plan-baseline-look",
      "document": "plan",
      "rootFields": ["baselineLook"],
      "patterns": ["/baselineLook/**"],
      "classification": "render-affecting",
      "stageRoots": ["base", "final"],
      "authorityEffects": ["whole-picture crop and grade"],
      "readerFiles": ["scripts/producer/render.py", "scripts/producer/motion/baseline_look.py"],
      "mutations": [
        {"caseId": "baseline-zoom", "fixture": "short-basic", "pointer": "/baselineLook/zoom", "after": 1.08, "expectedChangedRoots": ["plan.base", "plan.final"], "expectedBaseReuse": false}
      ]
    },
    {
      "effectId": "plan-reframe",
      "document": "plan",
      "rootFields": ["reframe"],
      "patterns": ["/reframe/**"],
      "classification": "render-affecting",
      "stageRoots": ["base", "final"],
      "authorityEffects": ["fill, face, blurpad, manual crop, or split layout"],
      "readerFiles": ["scripts/producer/render.py", "scripts/producer/plan_lint_reframe.py"],
      "mutations": [
        {"caseId": "reframe-strategy", "fixture": "short-basic", "pointer": "/reframe/strategy", "after": "center", "expectedChangedRoots": ["plan.base", "plan.final"], "expectedBaseReuse": false}
      ]
    },
    {
      "effectId": "plan-face-geometry",
      "document": "plan",
      "rootFields": ["faceBBoxNorm"],
      "patterns": ["/faceBBoxNorm/**"],
      "classification": "render-affecting",
      "stageRoots": ["base", "scene", "composite", "final"],
      "authorityEffects": ["global measured face geometry for recomposition and unpinned face-aware graphic placement"],
      "readerFiles": ["scripts/producer/motion/recompose.py", "scripts/producer/plan_lint_face.py", "scripts/producer/graphics/placement_context.py", "scripts/producer/graphics/exit_on_cut.py", "scripts/producer/render_stage_roots.py"],
      "mutations": [
        {"caseId": "face-geometry", "fixture": "longform-rail", "pointer": "/faceBBoxNorm/0", "after": 0.42, "expectedChangedRoots": ["plan.base", "plan.composite", "plan.final", "plan.scene.0000"], "expectedBaseReuse": false}
      ]
    },
    {
      "effectId": "plan-punch-ins",
      "document": "plan",
      "rootFields": ["punchIns"],
      "patterns": ["/punchIns/**"],
      "classification": "render-affecting",
      "stageRoots": ["base", "final"],
      "authorityEffects": ["zoom, pan, attack, hold, and release windows"],
      "readerFiles": ["scripts/producer/render.py", "scripts/producer/motion/punch_in.py"],
      "mutations": [
        {"caseId": "punch-zoom", "fixture": "short-basic", "pointer": "/punchIns/0/zoom", "after": 1.2, "expectedChangedRoots": ["plan.base", "plan.final"], "expectedBaseReuse": false}
      ]
    },
    {
      "effectId": "plan-broll",
      "document": "plan",
      "rootFields": ["brollTrack"],
      "patterns": ["/brollTrack/**"],
      "classification": "render-affecting",
      "stageRoots": ["base", "composite", "final"],
      "authorityEffects": ["picture replacement plus compositor occlusion windows"],
      "readerFiles": ["scripts/producer/render.py", "scripts/producer/broll/broll_insert.py"],
      "mutations": [
        {"caseId": "broll-timing", "fixture": "short-basic", "pointer": "/brollTrack/0/outEnd", "after": 2.7, "expectedChangedRoots": ["plan.base", "plan.composite", "plan.final"], "expectedBaseReuse": false}
      ]
    },
    {
      "effectId": "plan-title-cards",
      "document": "plan",
      "rootFields": ["titleCards"],
      "patterns": ["/titleCards/**"],
      "classification": "render-affecting",
      "stageRoots": ["base", "composite", "final"],
      "authorityEffects": ["legacy card pixels, caption suppression, and compositor occlusion"],
      "readerFiles": ["scripts/producer/render.py", "scripts/producer/captions/overlays.py"],
      "mutations": [
        {"caseId": "title-card-copy", "fixture": "short-basic", "pointer": "/titleCards/0/text", "after": "AFTER TITLE", "expectedChangedRoots": ["plan.base", "plan.composite", "plan.final"], "expectedBaseReuse": false}
      ]
    },
    {
      "effectId": "plan-graphics-scene",
      "document": "plan",
      "rootFields": ["graphicsTrack"],
      "patterns": ["/graphicsTrack/**"],
      "classification": "render-affecting",
      "stageRoots": ["scene", "composite", "final"],
      "authorityEffects": ["HyperFrames intent, placement, alpha composite, and timing"],
      "readerFiles": ["scripts/producer/graphics/graphics_render.py", "scripts/producer/graphics/graphics_stage.py"],
      "mutations": [
        {"caseId": "ordinary-scene-copy", "fixture": "short-basic", "pointer": "/graphicsTrack/0/spec/text", "after": "AFTER GRAPHIC", "expectedChangedRoots": ["plan.composite", "plan.final", "plan.scene.0000"], "expectedBaseReuse": true}
      ]
    },
    {
      "effectId": "plan-graphics-presenter-frame",
      "document": "plan",
      "rootFields": [],
      "patterns": ["/graphicsTrack/*/kind", "/graphicsTrack/*/spec/presenterFrame"],
      "classification": "render-affecting",
      "stageRoots": ["scene", "composite", "final"],
      "authorityEffects": ["opaque MP4 versus alpha MOV and live-presenter hole composition"],
      "readerFiles": ["scripts/producer/graphics/pip_hole.py", "scripts/producer/graphics/graphics_render.py"],
      "mutations": [